{
  "$schema": "https://json-schema.org/draft/2020-12/schema",
  "title": "Design",
  "description": "A complete design: one theme and one viewport applied to an ordered\nlist of screens.",
  "type": "object",
  "properties": {
    "app_window": {
      "description": "The shared app window inside the viewport. Choose its bounds once\nper candidate. Each screen must then have exactly one\ntop-level non-void element marked `data-swift-design-window`.",
      "anyOf": [
        {
          "$ref": "#/$defs/AppWindow"
        },
        {
          "type": "null"
        }
      ]
    },
    "outline": {
      "description": "The screen titles of the complete design, in order. A preview design\nlists more titles than it has screens: the app continues it from\nthis list later. Leave it empty when the design is complete.",
      "type": "array",
      "items": {
        "type": "string"
      }
    },
    "screens": {
      "description": "Screens in flow order.",
      "type": "array",
      "items": {
        "$ref": "#/$defs/Screen"
      }
    },
    "theme": {
      "description": "Visual identity applied to every screen.",
      "$ref": "#/$defs/Theme"
    },
    "title": {
      "description": "Design title, shown in the editor and the session.",
      "type": "string"
    },
    "transition": {
      "description": "How the presentation moves from one screen to the next. Leave it\nout to switch screens instantly without scrolling between them.",
      "anyOf": [
        {
          "$ref": "#/$defs/Transition"
        },
        {
          "type": "null"
        }
      ]
    },
    "viewport": {
      "description": "The px canvas every screen is laid out on. Set it from the\nbrief's target platform: 1440 by 900 for desktop web, 390 by 844\nfor a phone, 1024 by 768 for a tablet. Absent means 1440 by 900.",
      "$ref": "#/$defs/Viewport",
      "default": {
        "height": 900,
        "width": 1440
      }
    }
  },
  "additionalProperties": false,
  "required": [
    "title",
    "theme",
    "screens"
  ],
  "$defs": {
    "AppWindow": {
      "description": "The app window rectangle inside a design viewport.",
      "type": "object",
      "properties": {
        "height": {
          "description": "Window height in px.",
          "type": "integer",
          "format": "uint32",
          "minimum": 0
        },
        "left": {
          "description": "Distance from the viewport left edge in px.",
          "type": "integer",
          "format": "uint32",
          "minimum": 0
        },
        "top": {
          "description": "Distance from the viewport top edge in px.",
          "type": "integer",
          "format": "uint32",
          "minimum": 0
        },
        "width": {
          "description": "Window width in px.",
          "type": "integer",
          "format": "uint32",
          "minimum": 0
        }
      },
      "additionalProperties": false,
      "required": [
        "left",
        "top",
        "width",
        "height"
      ]
    },
    "FontSet": {
      "description": "Default CSS font family names.",
      "type": "object",
      "properties": {
        "body": {
          "description": "Family for every other text element that sets no font.",
          "type": "string"
        },
        "heading": {
          "description": "Family for text elements with role `title` or `heading`.",
          "type": "string"
        },
        "mono": {
          "description": "Family for code elements.",
          "type": "string"
        }
      },
      "additionalProperties": false,
      "required": [
        "heading",
        "body",
        "mono"
      ]
    },
    "Palette": {
      "description": "Default colors as `#rrggbb` hex strings.",
      "type": "object",
      "properties": {
        "accent": {
          "description": "Color for highlights, shapes, and chart series that set no color.",
          "type": "string"
        },
        "background": {
          "description": "Screen background color when a screen sets no background.",
          "type": "string"
        },
        "muted": {
          "description": "Secondary color for captions, rules, and table stripes.",
          "type": "string"
        },
        "text": {
          "description": "Text color when an element sets no color.",
          "type": "string"
        }
      },
      "additionalProperties": false,
      "required": [
        "background",
        "text",
        "accent",
        "muted"
      ]
    },
    "Screen": {
      "description": "One screen: an HTML fragment for the design's viewport, CSS for\nthat fragment, a name, and notes.",
      "type": "object",
      "properties": {
        "css": {
          "description": "CSS for this screen only. The server scopes every selector to\nthis screen. Use plain selectors such as `.title` or `h1`. Use the\ntheme through `var(--background)`, `var(--text)`, `var(--accent)`,\n`var(--muted)`, `var(--heading-font)`, `var(--body-font)`,\n`var(--mono-font)`. No `@import`, no viewport units, no `<`.",
          "type": [
            "string",
            "null"
          ]
        },
        "html": {
          "description": "The screen as one HTML fragment. The canvas is the design's\n`viewport` in px; use px units. Allowed: headings, text, lists, tables, `<img>`\nwith `src=\"/uploads/{name}\"`, inline `<svg>`, `<pre><code>`,\n`<blockquote>`, `<a>`, `<details>`, `<label>`, `<input>` with\ntype `checkbox` or `radio`. Not allowed: `<script>`, `<style>`,\n`<iframe>`, `<object>`, `<embed>`, `<link>`, `<meta>`, `<form>`,\n`<button>`, other input types, media, comments, `on*`\nattributes, `javascript:` and `data:` URLs, external images.\nClose every tag. A link with `href=\"#screen-3\"` opens screen 3,\ncounted from 1.",
          "type": "string"
        },
        "name": {
          "description": "A short name for the screen, such as `Home` or `Checkout`. Shown\nin the editor. Empty means the editor derives one from the html.",
          "type": "string"
        },
        "notes": {
          "description": "Design notes: intent, states, or handoff remarks. Never rendered\non the screen.",
          "type": [
            "string",
            "null"
          ]
        }
      },
      "additionalProperties": false,
      "required": [
        "html"
      ]
    },
    "Theme": {
      "description": "Default colors and fonts that elements inherit when they omit their\nown.",
      "type": "object",
      "properties": {
        "colors": {
          "description": "Default colors.",
          "$ref": "#/$defs/Palette"
        },
        "fonts": {
          "description": "Default font families.",
          "$ref": "#/$defs/FontSet"
        },
        "name": {
          "description": "Theme name shown in the editor.",
          "type": "string"
        }
      },
      "additionalProperties": false,
      "required": [
        "name",
        "colors",
        "fonts"
      ]
    },
    "Transition": {
      "description": "How the design moves from one screen to the next.",
      "type": "object",
      "properties": {
        "axis": {
          "description": "The direction the screens travel. Ignored by `none`, `fade`, and\n`zoom`, which do not travel.",
          "$ref": "#/$defs/TransitionAxis",
          "default": "vertical"
        },
        "duration_ms": {
          "description": "How long one transition takes, in milliseconds. Use 0 to 3000.\nIgnored by `none`, which always cuts.",
          "type": "integer",
          "format": "uint32",
          "default": 450,
          "minimum": 0
        },
        "effect": {
          "description": "The visual effect between two screens.",
          "$ref": "#/$defs/TransitionEffect",
          "default": "push"
        }
      },
      "additionalProperties": false
    },
    "TransitionAxis": {
      "description": "The direction the screens travel.",
      "oneOf": [
        {
          "description": "The next screen arrives from below.",
          "type": "string",
          "const": "vertical"
        },
        {
          "description": "The next screen arrives from the right.",
          "type": "string",
          "const": "horizontal"
        }
      ]
    },
    "TransitionEffect": {
      "description": "The visual effect between two screens.",
      "oneOf": [
        {
          "description": "The next screen replaces this one at once.",
          "type": "string",
          "const": "none"
        },
        {
          "description": "The two screens cross-fade.",
          "type": "string",
          "const": "fade"
        },
        {
          "description": "Both screens travel along the axis. The old screen leaves as the\nnew one arrives. Deck files written by Swift Deck name this\neffect `slide`; that name still loads.",
          "type": "string",
          "const": "push"
        },
        {
          "description": "The new screen travels in over the old one. The old one stays\nstill.",
          "type": "string",
          "const": "cover"
        },
        {
          "description": "The new screen grows in as the old one shrinks away.",
          "type": "string",
          "const": "zoom"
        }
      ]
    },
    "Viewport": {
      "description": "The canvas size of every screen in a design, in px. Screens use px\nunits against this size; the server scales the result to the frame.",
      "type": "object",
      "properties": {
        "height": {
          "description": "Canvas height in px, from 320 to 4096.",
          "type": "integer",
          "format": "uint32",
          "minimum": 0
        },
        "width": {
          "description": "Canvas width in px, from 320 to 4096.",
          "type": "integer",
          "format": "uint32",
          "minimum": 0
        }
      },
      "additionalProperties": false,
      "required": [
        "width",
        "height"
      ]
    }
  }
}
